<xs:schema xmlns:xs="http://www.w3.org/2001/XMLSchema">

    <xs:complexType name="VariableType">
        <xs:sequence>
            <xs:element name="nombre" type="xs:string"/>
            <xs:element name="unidad" type="xs:string"/>
            <xs:element name="valor" type="xs:double"/> 
        </xs:sequence>
    </xs:complexType>

    <xs:element name="MensajeDistribucion">
        <xs:complexType>
            <xs:sequence>
                <xs:element name="Variable" type="VariableType" minOccurs="3" maxOccurs="unbounded"/>
            </xs:sequence>
            <xs:attribute name="idServidor" type="xs:string" use="required"/>
            <xs:attribute name="codificacion" use="required">
                <xs:simpleType>
                    <xs:restriction base="xs:string">
                        <xs:enumeration value="XML"/>
                        <xs:enumeration value="JSON"/>
                    </xs:restriction>
                </xs:simpleType>
            </xs:attribute>
        </xs:complexType>
    </xs:element>

</xs:schema>