<?xml version="1.0" encoding="UTF-8" standalone="no"?>
<MensajeDistribucion xmlns:xsi="http://www.w3.org/2001/XMLSchema-instance" codificacion="XML" idServidor="SERV-1" xsi:noNamespaceSchemaLocation="recursos/distribucion.xsd">
    <Variable>
        <nombre>temperatura</nombre>
        <unidad>°C</unidad>
        <valor>24.62</valor>
    </Variable>
    <Variable>
        <nombre>dióxido de azufre (SO2)</nombre>
        <unidad>µg/m³</unidad>
        <valor>27.93</valor>
    </Variable>
    <Variable>
        <nombre>ozono (O3)</nombre>
        <unidad>µg/m³</unidad>
        <valor>32.57</valor>
    </Variable>
</MensajeDistribucion>